<?xml version="1.0" encoding="UTF-8"?>
<dataroot xmlns:od="urn:schemas-microsoft-com:officedata" xmlns:xsi="http://www.w3.org/2001/XMLSchema-instance"  xsi:noNamespaceSchemaLocation="03_Activities.xsd" generated="2025-05-15T17:27:42">
<_x0030_3_Activities>
<ActivityID>46</ActivityID>
<ActivityName>Generated the RCADS-47-Y-JA-1 from RCADS-47-Y-EN</ActivityName>
<AssociatedAgent>29</AssociatedAgent>
<ActivityDate>2020-12-15T00:00:00</ActivityDate>
<EntityType>1</EntityType>
<UsedEntityID>1</UsedEntityID>
<GenEntityID>54</GenEntityID>
</_x0030_3_Activities>
<_x0030_3_Activities>
<ActivityID>47</ActivityID>
<ActivityName>Generated the RCADS-47-CG-JA-1 from RCADS-47-CG-EN</ActivityName>
<AssociatedAgent>30</AssociatedAgent>
<ActivityDate>2020-12-15T00:00:00</ActivityDate>
<EntityType>1</EntityType>
<UsedEntityID>2</UsedEntityID>
<GenEntityID>55</GenEntityID>
</_x0030_3_Activities>
<_x0030_3_Activities>
<ActivityID>48</ActivityID>
<ActivityName>Generated the RCADS-47-Y-JA-2 from RCADS-47-Y-JA-1 and RCADS-47-Y-EN</ActivityName>
<AssociatedAgent>29</AssociatedAgent>
<ActivityDate>2022-02-09T00:00:00</ActivityDate>
<EntityType>1</EntityType>
<UsedEntityID>58</UsedEntityID>
<GenEntityID>60</GenEntityID>
</_x0030_3_Activities>
<_x0030_3_Activities>
<ActivityID>49</ActivityID>
<ActivityName>Generated the RCADS-47-CG-JA-2 from RCADS-47-CG-JA-1 and RCADS-47-CG-EN</ActivityName>
<AssociatedAgent>30</AssociatedAgent>
<ActivityDate>2022-02-09T00:00:00</ActivityDate>
<EntityType>1</EntityType>
<UsedEntityID>59</UsedEntityID>
<GenEntityID>61</GenEntityID>
</_x0030_3_Activities>
<_x0030_3_Activities>
<ActivityID>50</ActivityID>
<ActivityName>Generated the RCADS-25-Y-JA from RCADS-47-Y-JA-2 and RCADS-25-Y-EN</ActivityName>
<AssociatedAgent>29</AssociatedAgent>
<ActivityDate>2024-03-31T00:00:00</ActivityDate>
<EntityType>1</EntityType>
<UsedEntityID>62</UsedEntityID>
<GenEntityID>57</GenEntityID>
</_x0030_3_Activities>
<_x0030_3_Activities>
<ActivityID>51</ActivityID>
<ActivityName>Generated the RCADS-25-CG-JA from RCADS-47-CG-JA-2 and RCADS-25-CG-EN</ActivityName>
<AssociatedAgent>30</AssociatedAgent>
<ActivityDate>2024-03-31T00:00:00</ActivityDate>
<EntityType>1</EntityType>
<UsedEntityID>63</UsedEntityID>
<GenEntityID>56</GenEntityID>
</_x0030_3_Activities>
<_x0030_3_Activities>
<ActivityID>52</ActivityID>
<ActivityName>Generated the RCADS-47-Y-SL from RCADS-47-Y-EN</ActivityName>
<AssociatedAgent>31</AssociatedAgent>
<ActivityDate>2015-08-19T00:00:00</ActivityDate>
<EntityType>1</EntityType>
<UsedEntityID>1</UsedEntityID>
<GenEntityID>64</GenEntityID>
</_x0030_3_Activities>
<_x0030_3_Activities>
<ActivityID>53</ActivityID>
<ActivityName>Generated the RCADS-47-CG-SL from RCADS-47-CG-EN</ActivityName>
<AssociatedAgent>31</AssociatedAgent>
<ActivityDate>2015-08-19T00:00:00</ActivityDate>
<EntityType>1</EntityType>
<UsedEntityID>2</UsedEntityID>
<GenEntityID>65</GenEntityID>
</_x0030_3_Activities>
<_x0030_3_Activities>
<ActivityID>54</ActivityID>
<ActivityName>Generated the RCADS-47-Y-FI from RCADS-47-Y-EN</ActivityName>
<AssociatedAgent>32</AssociatedAgent>
<ActivityDate>2017-08-23T00:00:00</ActivityDate>
<EntityType>1</EntityType>
<UsedEntityID>1</UsedEntityID>
<GenEntityID>66</GenEntityID>
</_x0030_3_Activities>
<_x0030_3_Activities>
<ActivityID>55</ActivityID>
<ActivityName>Generated the RCADS-47-CG-FI from RCADS-47-CG-EN</ActivityName>
<AssociatedAgent>32</AssociatedAgent>
<ActivityDate>2017-08-23T00:00:00</ActivityDate>
<EntityType>1</EntityType>
<UsedEntityID>2</UsedEntityID>
<GenEntityID>67</GenEntityID>
</_x0030_3_Activities>
<_x0030_3_Activities>
<ActivityID>56</ActivityID>
<ActivityName>Generated the RCADS-47-CG-ZH-HANS from RCADS-47-CG-EN</ActivityName>
<AssociatedAgent>33</AssociatedAgent>
<ActivityDate>2018-03-28T00:00:00</ActivityDate>
<EntityType>1</EntityType>
<UsedEntityID>2</UsedEntityID>
<GenEntityID>70</GenEntityID>
</_x0030_3_Activities>
<_x0030_3_Activities>
<ActivityID>57</ActivityID>
<ActivityName>Generated the RCADS-25-CG-ZH-HANS from RCADS-47-CG-ZH-HANS and RCADS-25-CG-EN</ActivityName>
<AssociatedAgent>33</AssociatedAgent>
<ActivityDate>2024-04-04T00:00:00</ActivityDate>
<EntityType>1</EntityType>
<UsedEntityID>71</UsedEntityID>
<GenEntityID>72</GenEntityID>
</_x0030_3_Activities>
<_x0030_3_Activities>
<ActivityID>58</ActivityID>
<ActivityName>Generated the RCADS-25-Y-ZH-HANS from RCADS-47-Y-ZH-HANS-1 and RCADS-25-Y-EN (made edits to translation from 47-item youth translated version)</ActivityName>
<AssociatedAgent>33</AssociatedAgent>
<ActivityDate>2024-03-01T00:00:00</ActivityDate>
<EntityType>1</EntityType>
<UsedEntityID>68</UsedEntityID>
<GenEntityID>69</GenEntityID>
</_x0030_3_Activities>
<_x0030_3_Activities>
<ActivityID>59</ActivityID>
<ActivityName>Generated the RCADS-47-Y-PL from RCADS-47-Y-EN</ActivityName>
<AssociatedAgent>34</AssociatedAgent>
<ActivityDate>2017-06-09T00:00:00</ActivityDate>
<EntityType>1</EntityType>
<UsedEntityID>1</UsedEntityID>
<GenEntityID>78</GenEntityID>
</_x0030_3_Activities>
<_x0030_3_Activities>
<ActivityID>60</ActivityID>
<ActivityName>Generated the RCADS-47-CG-PL from RCADS-47-CG-PL</ActivityName>
<AssociatedAgent>34</AssociatedAgent>
<ActivityDate>2017-06-09T00:00:00</ActivityDate>
<EntityType>1</EntityType>
<UsedEntityID>2</UsedEntityID>
<GenEntityID>79</GenEntityID>
</_x0030_3_Activities>
<_x0030_3_Activities>
<ActivityID>61</ActivityID>
<ActivityName>Generated the RCADS-25-Y-PL from RCADS-47-Y-PL and RCADS-25-Y-EN</ActivityName>
<AssociatedAgent>34</AssociatedAgent>
<ActivityDate>2017-06-09T00:00:00</ActivityDate>
<EntityType>1</EntityType>
<UsedEntityID>82</UsedEntityID>
<GenEntityID>80</GenEntityID>
</_x0030_3_Activities>
<_x0030_3_Activities>
<ActivityID>62</ActivityID>
<ActivityName>Generated the RCADS-25-CG-PL from RCADS-47-CG-PL and RCADS-25-CG-EN</ActivityName>
<AssociatedAgent>34</AssociatedAgent>
<ActivityDate>2017-06-09T00:00:00</ActivityDate>
<EntityType>1</EntityType>
<UsedEntityID>83</UsedEntityID>
<GenEntityID>81</GenEntityID>
</_x0030_3_Activities>
<_x0030_3_Activities>
<ActivityID>63</ActivityID>
<ActivityName>Generated the MTT-35-Y-NO from MTT-35-Y-EN-2</ActivityName>
<AssociatedAgent>35</AssociatedAgent>
<ActivityDate>2025-05-13T00:00:00</ActivityDate>
<EntityType>1</EntityType>
<UsedEntityID>14</UsedEntityID>
<GenEntityID>84</GenEntityID>
</_x0030_3_Activities>
<_x0030_3_Activities>
<ActivityID>64</ActivityID>
<ActivityName>Generated the MTT-35-CG-NO from MTT-35-CG-EN-2</ActivityName>
<AssociatedAgent>35</AssociatedAgent>
<ActivityDate>2025-05-13T00:00:00</ActivityDate>
<EntityType>1</EntityType>
<UsedEntityID>10</UsedEntityID>
<GenEntityID>85</GenEntityID>
</_x0030_3_Activities>
<_x0030_3_Activities>
<ActivityID>1</ActivityID>
<ActivityName>Created the RCADS-47-Y-EN</ActivityName>
<AssociatedAgent>1</AssociatedAgent>
<ActivityDate>1999-05-26T00:00:00</ActivityDate>
<EntityType>1</EntityType>
<GenEntityID>1</GenEntityID>
</_x0030_3_Activities>
<_x0030_3_Activities>
<ActivityID>2</ActivityID>
<ActivityName>Generated the RCADS-47-CG-EN using RCADS-47-Y-EN</ActivityName>
<AssociatedAgent>6</AssociatedAgent>
<ActivityDate>2010-02-01T00:00:00</ActivityDate>
<EntityType>1</EntityType>
<UsedEntityID>1</UsedEntityID>
<GenEntityID>2</GenEntityID>
</_x0030_3_Activities>
<_x0030_3_Activities>
<ActivityID>3</ActivityID>
<ActivityName>Generated the RCADS-25-Y-EN using RCADS-47-Y-EN</ActivityName>
<AssociatedAgent>5</AssociatedAgent>
<ActivityDate>2012-02-13T00:00:00</ActivityDate>
<EntityType>1</EntityType>
<UsedEntityID>1</UsedEntityID>
<GenEntityID>3</GenEntityID>
</_x0030_3_Activities>
<_x0030_3_Activities>
<ActivityID>4</ActivityID>
<ActivityName>Generated the RCADS-47-Y-ES using RCADS-47-Y-EN</ActivityName>
<AssociatedAgent>19</AssociatedAgent>
<EntityType>1</EntityType>
<UsedEntityID>1</UsedEntityID>
<GenEntityID>4</GenEntityID>
</_x0030_3_Activities>
<_x0030_3_Activities>
<ActivityID>5</ActivityID>
<ActivityName>Generated MTT-35-CG-EN-3 (provider) using MTT-35-CG-EN-1</ActivityName>
<AssociatedAgent>3</AssociatedAgent>
<ActivityDate>2024-07-11T00:00:00</ActivityDate>
<EntityType>1</EntityType>
<UsedEntityID>5</UsedEntityID>
<GenEntityID>6</GenEntityID>
</_x0030_3_Activities>
<_x0030_3_Activities>
<ActivityID>6</ActivityID>
<ActivityName>Generated RCADS-25-Y-DE from RCADS-47-Y-DE (items) and RCADS-25-Y-EN (order)</ActivityName>
<AssociatedAgent>7</AssociatedAgent>
<ActivityDate>2024-09-01T00:00:00</ActivityDate>
<EntityType>1</EntityType>
<UsedEntityID>9</UsedEntityID>
<GenEntityID>7</GenEntityID>
</_x0030_3_Activities>
<_x0030_3_Activities>
<ActivityID>7</ActivityID>
<ActivityName>Generated MTT-35-CG-EN-2 (counselor) using MTT-35-CG-EN-1</ActivityName>
<AssociatedAgent>2</AssociatedAgent>
<ActivityDate>2017-12-01T00:00:00</ActivityDate>
<EntityType>1</EntityType>
<UsedEntityID>5</UsedEntityID>
<GenEntityID>10</GenEntityID>
</_x0030_3_Activities>
<_x0030_3_Activities>
<ActivityID>8</ActivityID>
<ActivityName>Test to compare anything to anything</ActivityName>
<AssociatedAgent>2</AssociatedAgent>
<ActivityDate>1967-02-25T00:00:00</ActivityDate>
<EntityType>1</EntityType>
<UsedEntityID>3</UsedEntityID>
<GenEntityID>12</GenEntityID>
</_x0030_3_Activities>
<_x0030_3_Activities>
<ActivityID>9</ActivityID>
<ActivityName>Created the MTT-35-Y-EN-1</ActivityName>
<AssociatedAgent>2</AssociatedAgent>
<ActivityDate>2017-08-14T00:00:00</ActivityDate>
<EntityType>1</EntityType>
<GenEntityID>13</GenEntityID>
</_x0030_3_Activities>
<_x0030_3_Activities>
<ActivityID>10</ActivityID>
<ActivityName>Created the MTT-35-CG-EN-1</ActivityName>
<AssociatedAgent>2</AssociatedAgent>
<ActivityDate>2017-08-14T00:00:00</ActivityDate>
<EntityType>1</EntityType>
<UsedEntityID>13</UsedEntityID>
<GenEntityID>5</GenEntityID>